{
  "$schema": "https://json-schema.org/draft/2020-12/schema",
  "$id": "https://rainpulse.local/contracts/events/job-completed.schema.json",
  "title": "RainPulse job.completed event",
  "type": "object",
  "additionalProperties": false,
  "required": [
    "schema_version",
    "event_id",
    "event_type",
    "occurred_at",
    "run_id",
    "job_id",
    "trace_id",
    "payload"
  ],
  "properties": {
    "schema_version": { "const": "1.0" },
    "event_id": { "type": "string", "format": "uuid" },
    "event_type": { "const": "job.completed" },
    "occurred_at": { "type": "string", "format": "date-time" },
    "run_id": { "type": "string", "format": "uuid" },
    "job_id": { "type": "string", "format": "uuid" },
    "trace_id": { "type": "string", "format": "uuid" },
    "payload": {
      "type": "object",
      "additionalProperties": false,
      "required": ["status", "started_at", "finished_at", "runtime_ms", "assets", "metrics"],
      "properties": {
        "status": { "const": "succeeded" },
        "started_at": { "type": "string", "format": "date-time" },
        "finished_at": { "type": "string", "format": "date-time" },
        "runtime_ms": { "type": "integer", "minimum": 0 },
        "assets": {
          "type": "array",
          "items": {
            "type": "object",
            "additionalProperties": false,
            "required": ["asset_type", "uri", "sha256", "size_bytes"],
            "properties": {
              "asset_type": { "type": "string", "minLength": 1 },
              "uri": { "type": "string", "format": "uri" },
              "sha256": { "type": "string", "pattern": "^[a-f0-9]{64}$" },
              "size_bytes": { "type": "integer", "minimum": 0 },
              "media_type": { "type": "string" }
            }
          }
        },
        "metrics": {
          "type": "object",
          "additionalProperties": { "type": "number" }
        },
        "diagnostics": {
          "type": "object"
        }
      }
    }
  }
}
